[
  {
    "id": "pilot",
    "name": "Pilot",
    "schemas": ["classes", "abilities", "equipment"],
    "flat": false
  },
  {
    "id": "mech",
    "name": "Mech",
    "schemas": ["chassis", "systems", "modules"],
    "flat": false
  },
  {
    "id": "crawler",
    "name": "Crawler",
    "schemas": ["crawlers", "crawler-bays", "crawler-tech-levels"],
    "flat": false
  },
  {
    "id": "denizens",
    "name": "Denizens",
    "schemas": [
      "bio-titans",
      "creatures",
      "drones",
      "factions",
      "meld",
      "npcs",
      "squads",
      "vehicles"
    ],
    "flat": false
  },
  {
    "id": "reference",
    "name": "Reference",
    "schemas": ["distances", "keywords", "roll-tables", "sources", "tech-levels", "traits"],
    "flat": false
  },
  {
    "id": "guides",
    "name": "Guides",
    "schemas": ["guides"],
    "flat": true
  }
]
